{
  "schema_id": "orgsmith/acl@1",
  "slug": "dev-mini",
  "posture": "open",
  "grants": [
    {
      "person": "p:daniel.jones",
      "docs": [
        "Engagements/Dean PLC/2020.02.07 - Engagement Letter - Dean PLC - EXECUTED.pdf",
        "Engagements/Dean PLC/2020.02.20 - Kickoff Memo - Pricing Study.docx",
        "Engagements/Dean PLC/Meeting Minutes 2020-05-17 - Dean PLC.docx",
        "Engagements/Johnson and Sons/2019.07.07 - Engagement Letter - Johnson and Sons - EXECUTED.pdf",
        "Engagements/Johnson and Sons/2019.07.20 - Kickoff Memo - Operational Review.docx",
        "Engagements/Johnson and Sons/2019.10.03 - Status Report - Johnson and Sons v2 FINAL.docx",
        "Engagements/Johnson and Sons/Meeting Minutes 2019-08-27 - Johnson and Sons.docx",
        "Engagements/Reeves, Miller and Thompson/2021.03.26 - Engagement Letter - Reeves, Miller and Thompson - EXECUTED.pdf",
        "Engagements/Reeves, Miller and Thompson/2021.08.31 - Status Report - Reeves, Miller and Thompson v2 FINAL.docx",
        "Engagements/Reeves, Miller and Thompson/Meeting Minutes 2021-06-23 - Reeves, Miller and Thompson.docx",
        "Finance/FY2021 Financial Summary.xlsx",
        "Finance/FY2022 Financial Summary.xlsx",
        "Firm/Firm Overview 2021 v3.docx"
      ]
    },
    {
      "person": "p:robert.miller",
      "docs": [
        "Engagements/Dean PLC/2020.02.07 - Engagement Letter - Dean PLC - EXECUTED.pdf",
        "Engagements/Dean PLC/2020.02.20 - Kickoff Memo - Pricing Study.docx",
        "Engagements/Dean PLC/Meeting Minutes 2020-05-17 - Dean PLC.docx",
        "Engagements/Johnson and Sons/2019.07.07 - Engagement Letter - Johnson and Sons - EXECUTED.pdf",
        "Engagements/Johnson and Sons/2019.07.20 - Kickoff Memo - Operational Review.docx",
        "Engagements/Johnson and Sons/2019.10.03 - Status Report - Johnson and Sons v2 FINAL.docx",
        "Engagements/Johnson and Sons/Meeting Minutes 2019-08-27 - Johnson and Sons.docx",
        "Engagements/Reeves, Miller and Thompson/2021.03.26 - Engagement Letter - Reeves, Miller and Thompson - EXECUTED.pdf",
        "Engagements/Reeves, Miller and Thompson/2021.08.31 - Status Report - Reeves, Miller and Thompson v2 FINAL.docx",
        "Engagements/Reeves, Miller and Thompson/Meeting Minutes 2021-06-23 - Reeves, Miller and Thompson.docx",
        "Finance/FY2021 Financial Summary.xlsx",
        "Finance/FY2022 Financial Summary.xlsx",
        "Firm/Firm Overview 2021 v3.docx"
      ]
    },
    {
      "person": "p:jennifer.fletcher",
      "docs": [
        "Engagements/Dean PLC/2020.02.07 - Engagement Letter - Dean PLC - EXECUTED.pdf",
        "Engagements/Dean PLC/2020.02.20 - Kickoff Memo - Pricing Study.docx",
        "Engagements/Dean PLC/Meeting Minutes 2020-05-17 - Dean PLC.docx",
        "Engagements/Johnson and Sons/2019.07.07 - Engagement Letter - Johnson and Sons - EXECUTED.pdf",
        "Engagements/Johnson and Sons/2019.07.20 - Kickoff Memo - Operational Review.docx",
        "Engagements/Johnson and Sons/2019.10.03 - Status Report - Johnson and Sons v2 FINAL.docx",
        "Engagements/Johnson and Sons/Meeting Minutes 2019-08-27 - Johnson and Sons.docx",
        "Engagements/Reeves, Miller and Thompson/2021.03.26 - Engagement Letter - Reeves, Miller and Thompson - EXECUTED.pdf",
        "Engagements/Reeves, Miller and Thompson/2021.08.31 - Status Report - Reeves, Miller and Thompson v2 FINAL.docx",
        "Engagements/Reeves, Miller and Thompson/Meeting Minutes 2021-06-23 - Reeves, Miller and Thompson.docx",
        "Finance/FY2021 Financial Summary.xlsx",
        "Finance/FY2022 Financial Summary.xlsx",
        "Firm/Firm Overview 2021 v3.docx"
      ]
    },
    {
      "person": "p:susan.wiley",
      "docs": [
        "Engagements/Dean PLC/2020.02.07 - Engagement Letter - Dean PLC - EXECUTED.pdf",
        "Engagements/Dean PLC/2020.02.20 - Kickoff Memo - Pricing Study.docx",
        "Engagements/Dean PLC/Meeting Minutes 2020-05-17 - Dean PLC.docx",
        "Engagements/Johnson and Sons/2019.07.07 - Engagement Letter - Johnson and Sons - EXECUTED.pdf",
        "Engagements/Johnson and Sons/2019.07.20 - Kickoff Memo - Operational Review.docx",
        "Engagements/Johnson and Sons/2019.10.03 - Status Report - Johnson and Sons v2 FINAL.docx",
        "Engagements/Johnson and Sons/Meeting Minutes 2019-08-27 - Johnson and Sons.docx",
        "Engagements/Reeves, Miller and Thompson/2021.03.26 - Engagement Letter - Reeves, Miller and Thompson - EXECUTED.pdf",
        "Engagements/Reeves, Miller and Thompson/2021.08.31 - Status Report - Reeves, Miller and Thompson v2 FINAL.docx",
        "Engagements/Reeves, Miller and Thompson/Meeting Minutes 2021-06-23 - Reeves, Miller and Thompson.docx",
        "Finance/FY2021 Financial Summary.xlsx",
        "Finance/FY2022 Financial Summary.xlsx",
        "Firm/Firm Overview 2021 v3.docx"
      ]
    },
    {
      "person": "p:michelle.lopez",
      "docs": [
        "Engagements/Dean PLC/2020.02.07 - Engagement Letter - Dean PLC - EXECUTED.pdf",
        "Engagements/Dean PLC/2020.02.20 - Kickoff Memo - Pricing Study.docx",
        "Engagements/Dean PLC/Meeting Minutes 2020-05-17 - Dean PLC.docx",
        "Engagements/Johnson and Sons/2019.07.07 - Engagement Letter - Johnson and Sons - EXECUTED.pdf",
        "Engagements/Johnson and Sons/2019.07.20 - Kickoff Memo - Operational Review.docx",
        "Engagements/Johnson and Sons/2019.10.03 - Status Report - Johnson and Sons v2 FINAL.docx",
        "Engagements/Johnson and Sons/Meeting Minutes 2019-08-27 - Johnson and Sons.docx",
        "Engagements/Reeves, Miller and Thompson/2021.03.26 - Engagement Letter - Reeves, Miller and Thompson - EXECUTED.pdf",
        "Engagements/Reeves, Miller and Thompson/2021.08.31 - Status Report - Reeves, Miller and Thompson v2 FINAL.docx",
        "Engagements/Reeves, Miller and Thompson/Meeting Minutes 2021-06-23 - Reeves, Miller and Thompson.docx",
        "Finance/FY2021 Financial Summary.xlsx",
        "Finance/FY2022 Financial Summary.xlsx",
        "Firm/Firm Overview 2021 v3.docx"
      ]
    },
    {
      "person": "p:cynthia.ball",
      "docs": [
        "Engagements/Dean PLC/2020.02.07 - Engagement Letter - Dean PLC - EXECUTED.pdf",
        "Engagements/Dean PLC/2020.02.20 - Kickoff Memo - Pricing Study.docx",
        "Engagements/Dean PLC/Meeting Minutes 2020-05-17 - Dean PLC.docx",
        "Engagements/Johnson and Sons/2019.07.07 - Engagement Letter - Johnson and Sons - EXECUTED.pdf",
        "Engagements/Johnson and Sons/2019.07.20 - Kickoff Memo - Operational Review.docx",
        "Engagements/Johnson and Sons/2019.10.03 - Status Report - Johnson and Sons v2 FINAL.docx",
        "Engagements/Johnson and Sons/Meeting Minutes 2019-08-27 - Johnson and Sons.docx",
        "Engagements/Reeves, Miller and Thompson/2021.03.26 - Engagement Letter - Reeves, Miller and Thompson - EXECUTED.pdf",
        "Engagements/Reeves, Miller and Thompson/2021.08.31 - Status Report - Reeves, Miller and Thompson v2 FINAL.docx",
        "Engagements/Reeves, Miller and Thompson/Meeting Minutes 2021-06-23 - Reeves, Miller and Thompson.docx",
        "Finance/FY2021 Financial Summary.xlsx",
        "Finance/FY2022 Financial Summary.xlsx",
        "Firm/Firm Overview 2021 v3.docx"
      ]
    }
  ]
}
